stop_id,stop_name,stop_lat,stop_lon
2,Bathurst St at Horsham Ave,43.768449,-79.441504
3,Royal York Rd at King Georges Rd,43.650225,-79.512691
7,Kennedy Rd at Huntingwood Dr,43.79502,-79.293198
8,Shorncliffe Ave at Newbridge Rd South Side,43.625815,-79.542151
9,Warden Ave at Tower Dr,43.754307,-79.298221
10,Thirtieth St at Alhena Ave,43.602452,-79.532974
12,Brown's Line at Woodbury Rd,43.599389,-79.544276
17,St Clair Ave East at Santamonica Blvd,43.712912,-79.276699
18,Driftwood Ave at Finch Ave West,43.757895,-79.513233
19,Rexdale Blvd at Martin Grove Rd,43.713759,-79.581288
25,Albion Rd at Finch Ave West,43.741208,-79.588821
28,Eglinton Ave East at Laird Dr East Side,43.713677,-79.363762
32,Yonge Blvd at Dunster Ave North Side,43.739877,-79.413594
34,Eglinton Ave East at Beachell St,43.742332,-79.222161
35,Keele St at Greenbrook Dr South Side,43.696812,-79.475456
42,Dufferin St at Gordon St,43.646696,-79.430224
44,Evans Ave at Gair Dr,43.610092,-79.551991
48,Elmhurst Dr at Muncey Ave,43.724247,-79.55368
50,Islington Ave at Norseman St,43.634118,-79.51889
54,Steeles Ave East at Midland Ave,43.826099,-79.297089
56,Bayview Ave at Hillcrest Ave,43.772666,-79.389534
58,Victoria Park Ave at Furnival Rd,43.712557,-79.297658
60,299 Norfinch Dr,43.768397,-79.531258
61,Kipling Ave at Hayhurst Rd,43.692199,-79.557813
63,Islington Ave at Finch Ave West South Side,43.74577,-79.568755
66,Sheppard Ave West at Yatescastle Dr,43.740433,-79.506722
69,Bayview Ave at Wilket Rd,43.74599,-79.383662
72,Hullmar Dr at Hisey Cres (South) North Side,43.770083,-79.529961
73,Davisville Ave at Forman Ave,43.701547,-79.380739
74,Warden Ave at Murray Glen Dr,43.756169,-79.299232
77,Main St Markham North at Bullock Dr,43.88138,-79.26167
81,Oakwood Ave at Highview Cres,43.676397,-79.43463
83,Weston Rd at Coral Gable Dr,43.73566,-79.538805
88,Albion Rd at Martin Grove Rd East Side,43.741652,-79.593301
90,84 Davisville Ave - Salvation Army,43.699124,-79.393026
94,York Mills Rd at Harrison Rd,43.7496,-79.378889
95,Warden Ave at Denison St North Side,43.82792,-79.326516
96,Lawrence Ave West at Scarlett Rd,43.698042,-79.523367
98,Sheppard Ave East at Conlins Rd East Side,43.80425,-79.189258
99,Royal York Rd at Trehorne Dr,43.690289,-79.529987
103,Wynford Dr at Don Mills Rd East Side,43.723099,-79.338338
104,Weston Rd at Fern Ave South Side,43.702116,-79.523302
106,Runnymede Rd at Maher Ave South Side,43.662007,-79.480732
108,McNicoll Ave at Markham Rd,43.823774,-79.24824
112,Church St at Weston Rd,43.703403,-79.524942
114,Royal York Rd at Darlingbrook Cres South Side,43.670934,-79.521782
116,Horner Ave at Alderbrae Ave,43.602828,-79.540636
119,Kingston Rd at Eastwood Ave,43.690304,-79.267035
120,Markham Rd at Edward Jeffreys Ave,43.896321,-79.26493
125,St Regis Cres at St Regis Cres North West Side,43.755144,-79.486134
127,McCowan Rd at McNicoll Ave,43.818132,-79.272206
128,Kennedy Rd at Village Green Sq,43.777387,-79.28586
130,Elmhurst Dr at Henley Cres West Side,43.728728,-79.571792
132,Foxwell St at Bruton Rd East Side,43.670048,-79.498441
134,Claireport Cres (West) at Albion Rd,43.746846,-79.634653
136,1216 Lansdowne Ave,43.673282,-79.449421
138,St Clair Ave West at Runnymede Rd West Side,43.66887,-79.484326
142,Opposite 3400 Keele St,43.747916,-79.48704
149,Kipling Ave at Goswell Rd,43.649052,-79.538342
151,Arleta Ave at Medal Lane,43.747718,-79.506309
152,Elmhurst Dr at Genthorn Ave,43.725054,-79.564692
156,Yonge St at Blythwood Rd,43.716269,-79.400257
159,Davisville Ave at Acacia Rd,43.69965,-79.389801
160,Yonge St at Bloor St West - Bloor Station,43.670441,-79.386954
161,Overlea Blvd at William Morgan Dr West Side,43.708042,-79.341738
167,Emmett Ave at Jane St,43.69001,-79.500826
169,Albion Rd at Elmhurst Dr,43.725287,-79.550901
170,Arrow Rd at Finch Ave West,43.753006,-79.535911
173,Bathurst St at Saranac Blvd,43.723161,-79.430751
175,Lawrence Ave East at Birchmount Rd,43.747291,-79.285133
176,Don Mills Rd at Chipping Rd,43.744827,-79.345629
177,225 Rexdale Blvd,43.712216,-79.574622
178,Kingston Rd at Cromwell Rd West Side,43.749401,-79.206461
181,Albion Rd at Westmore Dr East Side,43.743454,-79.603399
184,Warden Ave at Huntingwood Dr,43.78558,-79.311163
185,Finch Ave West at Edithvale Dr,43.777055,-79.427217
186,Victoria Park Ave at Sparks Ave,43.808645,-79.33851
188,Horner Ave at Kipling Ave,43.607357,-79.520485
195,Bathurst St at Baycrest Ave,43.729709,-79.43227
197,Lawrence Ave East at Morning Dew Rd,43.772188,-79.169034
198,Weston Rd at Denison Rd West,43.696304,-79.508408
199,Bathurst St at Woburn Ave,43.722434,-79.430385
201,Opposite 700 Arrow Rd,43.745407,-79.529314
202,Parliament St at Bloor St East,43.671579,-79.37081
204,Hullmar Dr at Monaco Crt,43.76526,-79.527908
207,Sheppard Ave East at Victoria Park Ave,43.775457,-79.322733
208,Yonge St at Wellesley St West - Wellesley Station,43.665025,-79.3847
209,Victoria Park Ave at Sheppard Ave East,43.775507,-79.323318
210,Wilson Ave at Murray Rd,43.729711,-79.471403
212,Major Mackenzie Dr East at Ridgecrest Rd,43.900656,-79.304807
223,Kennedy Rd at Forbes Rd South Side,43.755088,-79.27719
225,Kingston Rd at Old Kingston Rd,43.773854,-79.183177
239,Rexdale Blvd at Frost St East Side,43.712262,-79.563763
247,Neilson Rd at Malvern Town Centre (East Entrance),43.8079,-79.219949
249,Concorde Pl at Concorde Gate South Side,43.729085,-79.328506
250,Finch Ave West at Torresdale Ave West Side,43.772336,-79.451367
253,Warden Ave at Metropolitan Rd South Side,43.766822,-79.302799
255,Finch Ave East at Gaspe Rd East Side,43.785766,-79.388562
259,Neilson Rd at Neilson Park Dr,43.81439,-79.226549
260,Bathurst St at Danby Ave,43.749183,-79.437058
262,Eglinton Ave West at Oriole Pkwy East Side,43.705148,-79.40554
265,Lawrence Ave West at Benton Rd,43.710145,-79.47202
266,Islington Ave at Milady Rd,43.752433,-79.56851
267,Eglinton Ave East at Birchmount Rd,43.729763,-79.278137
268,Ellesmere Rd at Military Trail (East),43.78669,-79.188167
269,Humberline Dr at Huddersfield Rd,43.743504,-79.62084
270,Birchmount Rd at Danforth Ave,43.696844,-79.263822
271,Lansdowne Ave at Lappin Ave,43.665163,-79.445918
275,Ossington Ave at Leeds St South Side,43.663872,-79.426518
276,Neilson Rd at Sheppard Ave East,43.798278,-79.217892
278,Lawrence Ave West at Roxaline St,43.696704,-79.529765
280,Brown's Line at Horner Ave,43.601827,-79.54543
281,375 Norfinch Dr,43.770165,-79.531686
283,Beechgrove Dr at Dunstall Cres,43.772505,-79.160886
285,Weston Rd at Toryork Dr,43.753493,-79.542887
288,Coronation Dr at Manse Rd,43.76452,-79.173148
289,Albion Rd at Carrier Dr,43.74558,-79.61401
292,Lawrence Ave East at Morningside Ave,43.76821,-79.186546
294,Humber College Blvd at Humberline Dr,43.732115,-79.60889
295,Airport Rd at Northwest Dr,43.698901,-79.635642
298,715 Finch Ave West,43.769727,-79.462373
302,Kingston Rd at Sandown Ave,43.70858,-79.249674
303,Commissioners St at Logan Ave,43.651835,-79.337506
304,Victoria Park Ave at Meadowacres Dr,43.771798,-79.321251
305,Don Mills Rd at Deerford Rd,43.785281,-79.35057
306,Lawrence Ave East at Markham Rd,43.759631,-79.225553
309,Thirtieth St at Elder Ave,43.597919,-79.530991
313,Bathurst St at Bainbridge Ave,43.75091,-79.437474
316,Carrier Dr at Dansk Crt South Side,43.743515,-79.61471
317,Finch Ave West at Wilmington Ave,43.770363,-79.46065
318,Kennedy Rd at Brigstock Rd,43.761387,-79.279261
320,Morningside Ave at Morningview Trail,43.813343,-79.206063
321,123 Wynford Dr,43.726923,-79.329142
323,Finch Ave East at Kenneth Ave,43.780577,-79.412214
326,Bayview Ave at Opposite Garnier Park,43.800927,-79.395689
327,Dundas St West at Nottingham Dr,43.655267,-79.522723
328,6807 Steeles Ave West,43.756036,-79.611033
330,Old Weston Rd at Turnberry Ave,43.67825,-79.46463
333,Kennedy Rd at Cowdray Crt,43.780431,-79.286698
334,Finch Ave West at Yonge St West Side,43.779728,-79.416164
336,Sheppard Ave West at Maxwell St,43.754151,-79.445628
337,McCowan Rd at Alton Towers Cir (North),43.82702,-79.276064
341,Lawrence Ave East at Warden Ave,43.745187,-79.295013
342,Humberline Dr at Viewcrest Cir,43.732276,-79.617211
345,2002-2012 Sheppard Ave West,43.738711,-79.516709
346,Finch Ave West at Highway 27,43.73388,-79.603867
347,Kipling Ave at Tyre Ave,43.64501,-79.536573
348,Markham Rd at Lawrence Ave East,43.759679,-79.225072
352,Opposite 111 Disco Rd,43.700349,-79.599302
358,Culford Rd at George Anderson Dr,43.703148,-79.486494
360,Warden Ave at Glenbourne Park Dr,43.882273,-79.34063
361,Finch Ave East at Bridletowne Circle (East),43.797673,-79.312116
364,Ellesmere Rd at Zaph Ave,43.79184,-79.166565
365,185 Yorkland Blvd,43.771262,-79.335442
368,Eglinton Ave West at Islington Ave,43.679694,-79.539176
369,Victoria Park Ave at Dawes Rd,43.706606,-79.294903
376,Main St Markham North at Ramona Blvd - Markham GO Station,43.88287,-79.261889
382,Dixon Rd at Wincott Dr,43.695627,-79.552328
386,St Clair Ave East at Andrew Ave,43.720079,-79.244714
387,Kipling Ave at Genthorn Ave,43.723547,-79.572536
391,Opposite 225 Carrier Dr,43.749175,-79.615811
397,Lansdowne Ave at Davenport Rd,43.671425,-79.448192
401,Ellesmere Rd at Morrish Rd,43.790274,-79.173121
403,Eglinton Ave West at Scarlett Rd,43.683789,-79.511557
404,Weston Rd at Bartonville Ave West,43.689401,-79.496555
406,Evans Ave at Sherway Gate West Side,43.609022,-79.556933
408,Finch Ave West at Halesia Dr,43.733658,-79.606898
416,Triton Rd at Brimley Rd,43.773658,-79.261533
417,Belfield Rd at Shaft Rd West Side - Etobicoke North GO Stati,43.704066,-79.566634
418,Islington Ave at Kingsview Blvd,43.699602,-79.547712
419,Kipling Ave at Redwater Dr,43.715401,-79.568295
422,North Queen St at Medulla Ave,43.62126,-79.54552
425,Victoria Park Ave at Meadow Ave,43.681801,-79.28454
428,Belfield Rd at Shaft Rd - Etobicoke North GO Station,43.703944,-79.566147
430,75 Norfinch Dr,43.759874,-79.528818
431,Royal York Rd at Yorkleigh Ave,43.694243,-79.531969
432,275 Grandravine Dr,43.74816,-79.508358
436,Progress Ave at William Kitchen Rd West Side,43.770157,-79.27927
440,Arrow Rd at Pemican Crt North Side,43.749441,-79.532558
442,Ellesmere Rd at Dolly Varden Blvd West Side,43.775797,-79.235291
448,Thirtieth St at Elder Ave,43.597687,-79.530664
452,Horner Ave at Connorvale Ave,43.605477,-79.528801
453,Eglinton Ave East at Jonesville Cres,43.725127,-79.306649
454,Islington Ave at The Westway South Side,43.68824,-79.542872
459,Victoria Park Ave at Combermere Dr South Side,43.7558,-79.314681
461,Pape Ave at Harcourt Ave,43.677622,-79.344439
462,Bayview Ave at Cummer Ave,43.792145,-79.393441
465,480 Gordon Baker Rd,43.809298,-79.345222
467,Scarlett Rd at Foxwell St South Side,43.66854,-79.501042
471,Steeles Ave East at Lillian St East Side,43.799781,-79.41153
473,Steeles Ave West at Murray Ross Pkwy,43.776613,-79.516784
475,Finch Ave West at Humber College Blvd East Side,43.733914,-79.609339
477,Carlton St at Ontario St,43.663621,-79.37064
480,Dundas St West at Royalavon Cres,43.645406,-79.531899
481,Finch Ave West at Tangiers Rd,43.764272,-79.488069
484,Bathurst St at Marquette Ave,43.734195,-79.433342
485,Victoria Park Ave at Swanwick Ave,43.685254,-79.285963
486,Steeles Ave East at Putnam Gate,43.822702,-79.311866
491,Harbord St at St George St,43.663842,-79.398673
494,McCowan Rd at Raymerville Dr (North),43.881381,-79.28777
497,Sheppard Ave East at Murison Blvd West Side,43.798969,-79.214298
499,Steeles Ave West at Emerald Lane,43.793572,-79.440815
500,Eglinton Ave West at Martin Grove Rd East Side,43.674419,-79.562591
501,Opposite 685 Finch Ave West - St Bernard's Residence,43.771053,-79.457455
502,Driftwood Ave at Wilmont Dr,43.759887,-79.516325
503,Eglinton Ave East at Torrance Rd West Side,43.739553,-79.235824
504,Bayview Ave at Millwood Rd,43.70415,-79.374446
505,Albion Rd at Sanagan Rd,43.738903,-79.576364
506,2040 Don Mills Rd,43.763142,-79.347344
510,Sheppard Ave East at Walkway to Howell Sq,43.797075,-79.22322
513,Sheppard Ave East at Walkway to Hutcherson Sq,43.797653,-79.220285
514,Lawrence Ave West at Brucewood Cres,43.71859,-79.432803
515,Sheppard Ave East at Murison Blvd East Side,43.799156,-79.212357
516,North Queen St at The Queensway,43.614581,-79.5565
518,Yonge St at Wellesley St East - Wellesley Station,43.664812,-79.38436
522,Albion Rd at Carrier Dr,43.745412,-79.61457
523,Ellesmere Rd at Packard Blvd,43.770694,-79.257782
525,Kipling Ave at Kidron Valley Dr,43.756076,-79.588057
530,Warden Ave at Apartments (South of Finch),43.794836,-79.315109
532,Bathurst St at Shelborne Ave,43.715842,-79.428833
533,Jane St at Stanley Rd,43.743153,-79.514309
534,Finch Ave West at Goldfinch Crt East Side,43.772257,-79.450489
536,Dufferin St at Auburn Ave,43.675621,-79.442182
539,East Ave at Maberley Cres (North),43.785051,-79.133342
543,Finch Ave West at Virgilwood Dr - North York General Finch B,43.772698,-79.448324
545,East Ave at East Willow Gate,43.787304,-79.134296
547,Ossington Ave at Dundas St West,43.649438,-79.420865
550,Kipling Ave at Rathburn Rd,43.659757,-79.542992
552,Bathurst St at Wilson Ave,43.737188,-79.433814
557,Ellesmere Rd at Military Trail (East),43.786439,-79.188422
558,Lawrence Ave East at Meadowvale Rd,43.775359,-79.156006
559,Wellesley St West at Queen's Park Cres East East Side,43.663633,-79.390156
561,Wilson Ave at Murray Rd,43.729408,-79.471718
563,Victoria Park Ave at Ivordale Cres (South) South Side,43.752862,-79.313674
569,Davisville Ave at Bayview Ave West Side,43.702938,-79.374563
575,Keele St at Grandravine Dr,43.751925,-79.487981
576,35 Thorncliffe Park Dr,43.701905,-79.344381
586,Finch Ave East at Tollerton Ave,43.786413,-79.386577
587,Sheppard Ave East at Midland Ave,43.78511,-79.279041
588,Jane St at Troutbrooke Dr North Side,43.732115,-79.51113
589,Yonge Blvd at Yonge St West Side,43.734367,-79.404989
590,Kingston Rd at Parkcrest Dr,43.73564,-79.220356
591,Eglinton Ave East at Kingston Rd,43.743796,-79.212135
592,Consumers Rd at Victoria Park Ave West Side,43.771883,-79.322301
595,Townsend Rd at Freshmeadow Dr,43.810118,-79.356868
596,Bradstock Rd at Weston Rd East Side,43.739021,-79.538944
597,Islington Ave at The Queensway North Side,43.624047,-79.514742
600,Kennedy Rd at Linwood Ave,43.79345,-79.29257
602,Kingston Rd at Old Kingston Rd,43.774223,-79.182991
604,Dundas St West at Humber Hill Ave,43.665097,-79.501201
605,Kingston Rd at McCowan Rd,43.725443,-79.232312
606,Kipling Ave at Ronson Dr,43.702689,-79.562632
611,Lansdowne Ave at College St,43.651115,-79.440132
612,Neilson Rd at Keeler Blvd,43.790075,-79.211457
613,Markham Rd at Golden Ave,43.848191,-79.253938
616,Wilson Ave at Clyde Ave West Side,43.738736,-79.427049
617,Opposite 1686 Albion Rd,43.742378,-79.597507
618,Lawrence Ave West at Pine St,43.702096,-79.508129
619,Bayview Ave at Parkhurst Blvd North Side,43.708992,-79.376295
621,Steeles Ave West at Carpenter Rd West Side,43.792072,-79.448117
625,Steeles Ave West at Martin Grove Rd,43.758023,-79.60324
632,4979 Bathurst St,43.775615,-79.443268
635,Yonge St at Charles St West,43.668841,-79.386282
636,Warden Ave at Glen Springs Dr,43.804646,-79.320021
638,Warden Ave at Bridge to Markham Theatre,43.858114,-79.334684
643,North Queen St at Index Rd West Side,43.619313,-79.555066
645,533 Lansdowne Ave,43.655682,-79.441766
647,Kipling Ave at Eglinton Ave West,43.677048,-79.550647
650,Sentinel Rd at The Pond Rd South Side,43.769379,-79.5024
651,Lawrence Ave East at Bennett Rd,43.773036,-79.166039
657,Birchmount Rd at Kingston Rd North Side,43.693823,-79.262534
658,Royal York Rd at Renault Cres North Side,43.686157,-79.52813
660,Islington Ave at Jutland Rd,43.629036,-79.517124
662,Gateway Blvd South Side at Grenoble Dr South Side,43.711661,-79.330127
670,East Ave at Wheeling Dr,43.782809,-79.132408
675,Steeles Ave West at Yonge St - Centerpoint Mall,43.797286,-79.422816
680,Eglinton Ave West at Royal York Rd,43.68247,-79.526336
682,24 Fenmar Dr,43.758823,-79.537655
684,Eglinton Ave East at Danforth Rd,43.737338,-79.245756
685,Bathurst St at Dewlane Dr,43.78586,-79.445832
689,Dufferin St at Bridgeland Ave South Side,43.726345,-79.457682
690,Opposite 100 Carrier Dr,43.739311,-79.612839
695,Opposite 1450 Don Mills Rd,43.752754,-79.346954
697,Eglinton Ave East at Sinnott Rd,43.72919,-79.280808
699,Sheppard Ave East at Settlers Rd,43.774798,-79.326438
700,Bayview Ave at Blythwood Rd,43.720818,-79.378698
701,Yonge St at Woodlawn Ave East,43.683811,-79.392236
703,Judson St at Horner Ave,43.612349,-79.515013
705,1138 Bathurst St,43.675365,-79.415294
706,Victoria Park Ave at Woodale Ave,43.683422,-79.285188
710,Dixon Rd at Tamarack Cir,43.698427,-79.539973
711,Military Trail at Bobmar Rd,43.782638,-79.177488
714,McCowan Rd at 14Th Ave,43.849399,-79.279883
717,Sheppard Ave East at Kennedy Rd,43.783432,-79.288075
718,Islington Ave at Rathburn Rd South Side,43.662127,-79.531147
723,Kingston Rd at Lawrence Ave East,43.767363,-79.189589
724,Bayview Ave at Ruddington Dr,43.787893,-79.392586
725,Kennedy Rd at Perthshire St,43.809073,-79.300661
727,Victoria Park Ave at Eglinton Ave East,43.724094,-79.302236
731,Port Union Rd at Clappison Blvd,43.7815,-79.137591
736,Steeles Ave East at Tarbert Rd,43.804084,-79.392106
739,Sheppard Ave West at Yeomans Rd East Side,43.754366,-79.443496
740,Belfield Rd at C.N. West Spur,43.699972,-79.583628
742,Cordova Ave at Central Park Roadway,43.647886,-79.52675
743,Warden Ave at Glencove Dr,43.859654,-79.334719
744,Foxwell St at Jane St,43.671507,-79.493975
746,Kingston Rd at Fenwood Heights West Side,43.727383,-79.230088
747,Sheppard Ave West at Wilson Heights Blvd East Side,43.751748,-79.4556
748,Eglinton Ave East at Mt Pleasant Rd,43.708536,-79.389991
749,McCowan Rd at Commander Blvd North Side,43.796506,-79.261528
752,1111 Finch Ave West,43.767047,-79.474414
755,Weston Rd at Coronado Crt,43.740185,-79.539566
756,Dixon Rd at Kipling Ave,43.694487,-79.558316
761,McCowan Rd at 14Th Ave North Side,43.850231,-79.279673
763,Lawrence Ave East at Ben Stanton Blvd East Side,43.756956,-79.238185
767,Dixon Rd at Kipling Ave,43.694072,-79.558873
768,Jane St at Sheppard Ave West South Side,43.738911,-79.513248
770,Don Mills Rd at Seneca Hill Dr,43.790373,-79.354328
772,Gary Dr at Langside Ave,43.711073,-79.518539
774,Islington Ave at Rathburn Rd,43.662257,-79.530948
777,Albion Rd at Martin Grove Rd,43.742028,-79.593932
779,Islington Ave at Van Dusen Blvd,43.641412,-79.521937
780,Pape Ave at Mortimer Ave,43.685846,-79.347563
781,Tuscan Gate at St Regis Cres (South) South Side,43.75402,-79.483974
782,Markham Rd at Markanna Dr,43.740623,-79.217674
789,Humberwood Blvd at Arborwood Dr,43.723541,-79.618849
792,80 Progress Ave,43.771997,-79.275892
794,Dufferin St at Alma Ave,43.644682,-79.429661
796,Eglinton Ave West at Lascelles Blvd East Side,43.705641,-79.403202
797,Lawrence Ave East at Opposite Cedarbrae Mall,43.758785,-79.230855
798,Morningside Ave at Ellesmere Rd,43.785187,-79.193109
800,Sheppard Ave East at Brimley Rd East Side,43.787581,-79.267739
802,Bayview Ave at Fifeshire Rd (South) South Side,43.75459,-79.385637
806,Steeles Ave East at Victoria Park Ave West Side,43.815581,-79.342165
808,Main St Markham North at Highway 7,43.873549,-79.259546
811,Lawrence Ave East at Manse Rd East Side,43.770643,-79.175848
817,Runnymede Rd at Maher Ave,43.662105,-79.480571
820,Steeles Ave East at McCowan Rd,43.830837,-79.275525
821,Islington Ave at Fordwich Cres,43.727108,-79.560871
822,Old Kingston Rd at Military Trail,43.782122,-79.172674
824,Lawrence Ave West at Royal York Rd,43.696286,-79.532489
825,345 Morningside Ave,43.775468,-79.18886
827,Lawrence Ave East at Underhill Dr,43.740918,-79.324491
829,Major Mackenzie Dr East at McCowan Rd,43.903281,-79.293772
830,Sheffield St at Hafis Rd,43.706257,-79.47105
834,Ellesmere Rd at Calthorpe Ave,43.788586,-79.180524
835,Harbord St at Brunswick Ave,43.662181,-79.406126
836,Sheppard Ave East at Palmdale Dr,43.77783,-79.311293
841,Victoria Park Ave at Curlew Dr South Side,43.747467,-79.311799
843,Steeles Ave East at Mountcastle Gate,43.820394,-79.320622
845,Steeles Ave West at Founders Rd - York University,43.779428,-79.504234
849,Bathurst St at Covington Rd,43.721136,-79.430335
852,Warden Ave at Sheppard Ave East,43.77887,-79.308173
853,Kennedy Rd at Norcap Ave,43.797157,-79.294171
856,Bayview Ave at Lawrence Ave East - York University Glendon C,43.727267,-79.381567
860,North Queen St at Nova Rd,43.616293,-79.557141
862,3292 Bayview Ave,43.789946,-79.393248
864,Shaw St at Adelaide St West,43.642626,-79.415367
866,Kennedy Rd at Antrim Cres South Side,43.771331,-79.283286
869,Runnymede Rd at Webb Ave,43.658554,-79.479255
873,Lawrence Ave East at Centennial Rd,43.777575,-79.145968
876,Eglinton Ave West at Walkway to Emmett Ave,43.684593,-79.508136
878,Finch Ave East at Maxome Ave,43.783459,-79.399176
879,East Ave at Clark Secor Pl North Side,43.78995,-79.135406
882,209 Carrier Dr,43.747234,-79.615107
884,Wilson Ave at King High Ave,43.735702,-79.442466
885,Sheppard Ave West at Jane St,43.73919,-79.513494
887,Davisville Ave at Acacia Rd,43.699932,-79.389138
889,Gervais Dr at Wynford Dr South Side,43.723081,-79.336445
891,Kipling Ave at Hinton Rd,43.725707,-79.573246
893,Kipling Ave at Westhumber Blvd,43.72821,-79.574872
895,Progress Ave at Roadway to Centennial College,43.783526,-79.231618
897,St Clair Ave East at Midland Ave,43.71894,-79.251064
898,150 Staines Rd West Side,43.822964,-79.219024
901,Islington Ave at Summitcrest Dr,43.683282,-79.540697
907,Warden Ave at Eglinton Ave East North Side,43.728424,-79.287699
908,Finch Ave East at Yonge St - Finch Station,43.780191,-79.414106
909,Royal York Rd at Yorkleigh Ave,43.694162,-79.531677
910,Yonge St at Lytton Blvd,43.716726,-79.400585
911,McCowan Rd at Alton Towers Cir (South),43.822377,-79.273762
914,Jane St at Firgrove Cres (North) South Side,43.754548,-79.517122
916,Islington Ave at Albion Rd,43.7377,-79.565693
920,Bayview Ave at Blythwood Rd South Side,43.720431,-79.378945
921,Don Mills Rd at Green Belt Dr North Side,43.727486,-79.340618
925,Jane St at Exbury Rd North Side,43.729646,-79.510597
927,Steeles Ave East at Townsend Rd West Side,43.811939,-79.358022
928,Wilson Ave at Julian Rd West Side - Humber River Hospital,43.724669,-79.491492
930,Keele St at Lawrence Ave West,43.708825,-79.478254
937,Don Mills Rd at The Donway East (South) North Side,43.732636,-79.342026
938,Neilson Rd at Crow Trail,43.812353,-79.225946
943,Eglinton Ave East at Banff Rd,43.710122,-79.38211
946,Oakwood Ave at Rosemount Ave,43.678178,-79.435399
947,Sheppard Ave East at Boydwood Lane,43.80462,-79.15811
950,Arleta Ave at John Lindsay Crt,43.745902,-79.502119
952,Dundas St West at Windermere Ave,43.665544,-79.48605
954,Keele St at Rustic Rd,43.717966,-79.480244
955,Yonge St at Lord Seaton Rd South Side,43.752127,-79.408292
957,Yonge St at King St West - King Station,43.649249,-79.378022
959,Steeles Ave East Loop,43.798341,-79.417889
960,Lake Shore Blvd West at Thirty Seventh St,43.593494,-79.537978
963,Steeles Ave East at Walkway to Norn Cres,43.832317,-79.270029
964,Warden Ave at Walbon Rd,43.739791,-79.292609
966,Yonge St at Yonge Blvd South Side,43.733994,-79.404613
967,145 Carrier Dr,43.741627,-79.613925
975,Oak St at Weston Rd East Side,43.707912,-79.53278
978,Runnymede Rd at St John's Rd,43.663697,-79.48124
979,Steeles Ave West at Dufferin St,43.787469,-79.469755
980,Lawrence Ave West at Benton Rd,43.710536,-79.471373
982,Eglinton Ave East at Kennedy Rd,43.732413,-79.267746
988,Eglinton Ave West at Jimmy Wisdom Way,43.696414,-79.447135
989,St Clair Ave East at Kennedy Rd,43.716705,-79.261083
999,Sheppard Ave East at Kennedy Rd,43.783046,-79.288704
1001,685 Finch Ave West,43.770935,-79.456814
1002,McCowan Rd at Coleraine Ave,43.838225,-79.276865
1003,Lawrence Ave East at Carnforth Rd,43.741633,-79.31401
1004,Hullmar Dr at Gosford Blvd,43.761854,-79.521309
1012,Driftwood Ave at Stong Crt,43.762084,-79.51697
1013,Finch Ave East at Kennedy Rd,43.801487,-79.29616
1014,Victoria Park Ave at Danforth Ave,43.691357,-79.288525
1017,Steeles Ave East at Laureleaf Rd,43.805432,-79.385852
1019,Yonge St at Queen St East - Queen Station,43.652319,-79.379085
1021,Overlea Blvd at Thorncliffe Park Dr (East) West Side,43.707457,-79.344198
1022,Birmingham St at Eighth St,43.602865,-79.507664
1025,Kingston Rd at Manderley Dr,43.688668,-79.269367
1032,Bayview Ave at The Bridle Path,43.738356,-79.382163
1034,Kennedy Rd at Bellbrook Rd,43.798949,-79.294947
1035,Finch Ave W at Virgilwood Dr West Side - North York General,43.772898,-79.448603
1036,Dufferin St at Glencairn Ave,43.706896,-79.453031
1037,Victoria Park Ave at Valdane Dr,43.718598,-79.299971
1038,Victoria Park Ave at Cassandra Blvd,43.754442,-79.314192
1039,Finch Ave East at Baylawn Dr,43.803284,-79.28868
1041,Jane St at Patika Ave,43.705192,-79.504228
1042,Kingston Rd at Military Trail,43.781393,-79.169994
1048,Opposite 636 Finch Ave East (Plaza),43.787498,-79.380413
1049,Markham Rd at Finch Ave East,43.812817,-79.242767
1050,Yonge St at Empress Ave - North York Centre Station,43.769149,-79.4127
1051,Islington Ave at Ridgevalley Cres North Side,43.67211,-79.535377
1053,Finch Ave East at Baylawn Dr,43.803004,-79.289136
1054,Wilson Ave at Faywood Blvd East Side,43.734763,-79.445833
1059,Steeles Ave West at Founders Rd East Side - York University,43.779212,-79.503758
1060,Royal York Rd at Lynngrove Ave,43.651466,-79.513239
1063,Ridgecrest Rd at Wiltshire Dr,43.89876,-79.303632
1066,3325 Warden Ave,43.814261,-79.324383
1069,Lawrence Ave East at Burnview Cres West Side,43.756528,-79.241423
1070,Kingston Rd at Fenwood Heights,43.727269,-79.229715
1071,Ossington Ave at Churchill Ave,43.652123,-79.421898
1073,Opposite 150 Culford Rd,43.705192,-79.487147
1075,Sheppard Ave West at Arrow Rd,43.735485,-79.529638
1077,Bathurst St at Shelborne Ave,43.716134,-79.429129
1079,Weston Rd at Kenhar Dr,43.761598,-79.544474
1082,Keele St at Diana Dr,43.740992,-79.485359
1083,Grandravine Dr at Derrydown Rd,43.75293,-79.491796
1084,Lawrence Ave West at Culford Rd East Side,43.706314,-79.487335
