stop_id,stop_name,stop_lat,stop_lon
5371,Warden Ave at Minford Ave North Side,43.737216,-79.291293
5373,Victoria Park Ave at Swanwick Ave,43.684926,-79.285674
5376,Warden Ave at Steeles Ave East,43.819365,-79.324229
5378,Pritchard Ave at Jane St East Side,43.669556,-79.492419
5379,Bayview Ave at Byng Ave North Side,43.782213,-79.391381
5380,Maple Leaf Dr at Roadway to 290-300 Queens Dr Apartments,43.709687,-79.502436
5384,Lawrence Ave East at McCowan Rd,43.755706,-79.245279
5386,Ellesmere Rd at Dundalk Dr West Side,43.765185,-79.284336
5387,Kennedy Rd at Cornwallis Dr South Side,43.751587,-79.275821
5388,Opposite 2791 Victoria Park Ave,43.782185,-79.326411
5389,Morning Star Dr at Collett Rd,43.710376,-79.649557
5390,Lawrence Ave West at Via Bagnato,43.71448,-79.452245
5393,Lawrence Ave West at Marlee Ave West Side,43.71559,-79.447093
5394,Yonge St at Irwin Ave,43.666768,-79.385426
5399,Markham Rd at Highglen Ave,43.851365,-79.254682
5401,Carlaw Ave at Dundas St East,43.664707,-79.341479
5403,Warden Ave at Walkway to Seagrave Cres,43.809176,-79.322148
5404,Dixon Rd at Chetta Pl,43.696037,-79.551671
5408,Bayview Ave at Byng Ave South Side,43.781659,-79.391546
5409,York Mills Rd at Banbury Rd (East),43.752639,-79.365268
5411,Albion Rd at Beaumonde Heights Park West Side,43.738716,-79.573613
5412,Runnymede Rd at Glenwood Ave,43.65703,-79.478841
5414,3636 Weston Rd,43.759232,-79.544263
5415,Gary Dr at Langside Ave,43.711282,-79.518289
5421,York Mills Rd at Bayview Ave,43.74787,-79.384519
5424,Steeles Ave West at Petrolia Rd,43.782395,-79.490224
5425,Keele St at Sir William Hearst Ave,43.724529,-79.48185
5426,Kingston Rd at Birchcliff Ave,43.691611,-79.264661
5432,The Bridle Walk at Major Mackenzie Dr East,43.899444,-79.309414
5435,Jane St at Yewtree Blvd North Side,43.755135,-79.516962
5441,Finch Ave East at Birchmount Rd,43.799172,-79.305756
5447,The Westway at Martin Grove Rd East Side,43.683365,-79.566594
5449,Islington Ave at Beaumonde Heights Dr North Side,43.742858,-79.567695
5451,Markham Rd at Progress Ave,43.781634,-79.233561
5452,Eglinton Ave East at Rosemount Dr,43.730969,-79.273818
5458,Kipling Ave at North Heights Rd,43.66486,-79.545581
5459,Weston Rd at Habitant Dr,43.746053,-79.541199
5461,Steeles Ave East at Walkway to Joycedale St,43.833683,-79.264264
5462,4325 McCowan Rd (Milliken Park Rec Centre),43.828928,-79.275068
5467,Norelco Dr at Ormont Dr,43.767357,-79.534477
5469,Airport Rd at Hull St,43.70411,-79.642841
5475,Keele St at Flamborough Dr,43.703006,-79.476876
5477,Don Mills Rd at Moatfield Dr South Side,43.758327,-79.34732
5480,Sheppard Ave East at Durnford Rd,43.800865,-79.150843
5481,The East Mall at The Queensway,43.61622,-79.546041
5486,Lawrence Ave East at Opposite Walkway to Ridgewood Rd,43.786215,-79.12498
5487,Dufferin St at Shanly St,43.663251,-79.436863
5488,Islington Ave at Gosfield Gate South Side,43.725271,-79.560044
5496,Bathurst St at Blue Flag Gate,43.768648,-79.441865
5498,Finch Ave East at McCowan Rd,43.807895,-79.266729
5502,Victoria Park Ave at St Clair Ave East,43.708618,-79.295766
5503,Royal York Rd at Country Club Dr,43.674485,-79.523226
5505,Horner Ave at Judson St,43.611721,-79.51549
5511,Eglinton Ave West at Ronald Ave,43.694246,-79.456973
5514,Yonge St at Crescent Rd South Side - Rosedale Station,43.676573,-79.389457
5515,45 Norfinch Dr,43.757191,-79.526818
5516,Sheppard Ave West at Kodiak Cres (South),43.751865,-79.466919
5517,Islington Ave at Westhampton Dr South Side,43.70418,-79.550141
5518,Ossington Ave at Churchill Ave,43.651764,-79.421588
5519,Steeles Ave East at Shadlock St,43.834084,-79.261385
5520,6355 Airport Rd,43.691085,-79.62516
5523,Finch Ave East at Alamosa Dr,43.789035,-79.373472
5529,Weston Rd at Bradstock Rd,43.739191,-79.539595
5532,Opposite 2650 St Clair Ave West,43.666472,-79.496591
5535,Warden Ave at Highway 7,43.855541,-79.33364
5536,Ellesmere Rd at Mornelle Crt,43.785001,-79.195193
5542,Bayview Ave at Garnier Park,43.801054,-79.395495
5545,Lansdowne Ave at Dupont St,43.666865,-79.446607
5549,Yonge St at Finch Ave West - Finch Station,43.779948,-79.415772
5552,Keele St at Ingram Dr,43.699279,-79.475771
5556,Park Rd (Zoo) at Kirkhams Rd East Side,43.81813,-79.175121
5558,Keele St at Lawrence Ave West North Side,43.709426,-79.478013
5559,Victoria Park Ave Loop at Steeles Ave East,43.81662,-79.341413
5566,Jane St at Eglinton Ave West North Side,43.684858,-79.498753
5568,Ellesmere Rd at Calverley Trail,43.78949,-79.176571
5570,Yonge St at Glengrove Ave West,43.719635,-79.401209
5574,Yonge St at Belsize Dr,43.700201,-79.396851
5575,York Mills Rd at Upper Highland Cres,43.745541,-79.396356
5576,Martin Grove Rd at Milkwood Ave,43.73022,-79.588737
5578,Eglinton Ave West at Old Forest Hill Rd,43.701626,-79.42291
5581,East Ave at East Willow Gate,43.787478,-79.134523
5582,Sheppard Ave East at Atrium Lane,43.800904,-79.150306
5586,Kennedy Rd at Brigstock Rd South Side,43.760979,-79.279507
5589,Weston Rd at Humber Blvd,43.683252,-79.480482
5591,Lake Shore Blvd West at Thirty First St,43.595155,-79.530407
5592,Opposite 49 Mabelle Ave,43.645504,-79.528623
5593,Littles Rd at Old Finch Ave,43.820932,-79.206036
5595,Kennedy Rd at Radnor Ave,43.746029,-79.27381
5596,Jane St at Trethewey Dr,43.697301,-79.502161
5598,Warden Ave at Fairfax Cres,43.716262,-79.282981
5601,Weston Rd at Burgundy Crt North Side,43.729288,-79.535903
5603,75 The East Mall,43.618788,-79.548016
5607,McCowan Rd at Gillingham Ave,43.835287,-79.276473
5611,Don Mills Rd at Finch Ave East,43.792867,-79.355008
5613,Victoria Park Ave at Meighen Ave,43.705359,-79.294425
5615,Eglinton Ave West at Bathurst St,43.701254,-79.424598
5619,Kingston Rd at Chine Dr,43.714299,-79.245098
5624,Kingston Rd at Resthaven Memorial Gardens,43.715819,-79.243388
5626,Bayview Ave at Truman Rd,43.760431,-79.386402
5628,Sheppard Ave East at Massie St West Side,43.792506,-79.245714
5632,York Mills Rd at Hedgewood Rd East Side,43.744875,-79.398732
5635,Kennedy Rd at Forbes Rd,43.75534,-79.276894
5636,Steeles Ave West at Capstan Gate,43.783447,-79.487039
5645,Victoria Park Ave at Elvaston Dr South Side,43.729518,-79.304809
5647,Garyray Dr at Norelco Dr,43.769757,-79.535855
5648,Oakwood Ave at St Clair Ave West North Side,43.680177,-79.435811
5652,Weston Rd at Dora Spencer Rd North Side,43.69228,-79.503078
5653,Opposite 1314 Military Trail,43.784336,-79.183802
5655,Finch Ave East at Cherokee Blvd,43.793549,-79.336707
5656,Bathurst St at Drewry Ave,43.780923,-79.444692
5657,Yonge St at Montgomery Ave,43.709702,-79.399096
5659,Ossington Ave at Harbord St,43.6584,-79.424161
5664,Dufferin St at Dundas St West,43.649459,-79.431252
5666,Victoria Park Ave at Draycott Dr South Side,43.731992,-79.305827
5675,Sheffield St at Densley Ave,43.705094,-79.47051
5679,Dundas St West at Shorncliffe Rd,43.631902,-79.544849
5681,Sheppard Ave West at Wilson Heights Blvd,43.75147,-79.45706
5682,Steeles Ave West at Old Weston Rd,43.771107,-79.543085
5692,549 Oakdale Rd,43.750547,-79.526479
5694,Oakwood Ave at St Clair Ave West,43.679367,-79.435722
5695,Weston Rd at Church St South Side,43.7027,-79.524832
5696,250 Consumers Rd,43.770565,-79.330154
5700,Bayview Ave at Fleming Cres North Side,43.707182,-79.375629
5701,Jane St at Courage Ave South Side,43.744734,-79.514671
5702,Warden Ave at 125 Bamburgh Cir Apts,43.81447,-79.32467
5704,Yonge St at Moore Park Ave,43.793966,-79.419209
5708,St Clair Ave West at Jane St,43.667011,-79.492085
5713,York Mills Rd at Old Yonge St,43.744926,-79.399283
5714,Steeles Ave West at Carpenter Rd,43.791875,-79.447721
5715,McCowan Rd at Walkway to Alanbull Sq,43.819978,-79.272989
5716,900 Kennedy Rd,43.739959,-79.27129
5717,Bathurst St at Bridgman Ave,43.674989,-79.414992
5718,Culford Rd at Ridge Point Cres,43.703315,-79.486721
5719,Islington Ave at Dixon Rd,43.696716,-79.546347
5724,Main St Markham North at Springdale Ave,43.885657,-79.26252
5727,Wilson Ave at Yonge Blvd East Side,43.741284,-79.414806
5732,Arleta Ave at Tina Crt,43.743611,-79.501445
5736,Weston Rd at Oak St,43.707859,-79.533756
5737,Pape Ave at Bain Ave,43.673043,-79.342537
5738,Humberwood Blvd at Honeyview Pl,43.733402,-79.619198
5745,Runnymede Rd at Colbeck St,43.655017,-79.477995
5746,Bathurst St at Patricia Ave North Side,43.78418,-79.44541
5747,McCowan Rd at Heritage Rd,43.870059,-79.285397
5748,Opposite 1801-1821 Albion Rd,43.745179,-79.611781
5750,Jane St at Goldwin Ave South Side,43.689014,-79.500424
5753,Ian MacDonald Blvd at The Chimneystack Rd,43.776417,-79.500781
5754,Arleta Ave at Spenvalley Dr,43.743797,-79.501596
5756,Steeles Ave West at Norfinch Dr,43.773471,-79.531611
5758,Culford Rd at Gulliver Rd,43.697985,-79.483987
5760,Maple Leaf Dr at Bourdon Ave,43.711288,-79.495864
5769,Runnymede Rd at Dundas St West,43.665816,-79.482314
5770,92 Oakdale Rd,43.739958,-79.525837
5771,Caledonia Rd at Innes Ave North Side,43.681242,-79.45715
5781,Gateway Blvd South Side at Sunny Glenway East Side,43.71162,-79.330353
5782,Wilson Ave at Clayson Rd West Side,43.717719,-79.523505
5784,Eglinton Ave East at Beachell St,43.742641,-79.221935
5785,Finch Ave East at Milliken Blvd,43.801717,-79.294427
5786,Scarlett Rd at Lawrence Ave West,43.697994,-79.522914
5787,Albion Rd at Calstock Dr,43.734052,-79.557996
5789,Dixon Rd at McManus Rd West Side,43.699229,-79.537414
5790,Kingston Rd at Fallingbrook Rd,43.682406,-79.279087
5791,Pape Ave at Canning Ave,43.682431,-79.346265
5792,Carlton St at Sherbourne St,43.66307,-79.373237
5795,Bathurst St at Finch Ave West South Side,43.773391,-79.443056
5798,Kingston Rd at Glen Everest Rd East Side,43.69801,-79.256199
5799,Ossington Ave at Davenport Rd,43.674502,-79.430794
5800,Maple Leaf Dr at Stella St,43.710329,-79.500126
5806,Sheppard Ave West at Brentwood Ave,43.758338,-79.425494
5809,McCowan Rd at Opposite Milliken Wells Shopping Centre,43.825007,-79.274966
5815,Victoria Park Ave at Ferncrest Gate,43.789178,-79.329409
5818,Islington Ave at Humber Summit Lane,43.761881,-79.573211
5819,Driftwood Ave at Yewtree Blvd,43.755583,-79.514158
5820,Islington Ave at Orrell Ave,43.656887,-79.528879
5821,Steeles Ave East at Leslie St,43.808226,-79.372863
5825,Don Mills Rd at The Donway West (North),43.741002,-79.344645
5826,John Garland Blvd at Mosque Cres (North),43.732458,-79.592402
5827,Victoria Park Ave at Rowena Dr,43.751604,-79.313152
5828,Pape Ave at Danforth Ave,43.679055,-79.344994
5829,Grenoble Dr at Vendome Pl West Side,43.715557,-79.328566
5831,Kipling Ave at Kingsview Blvd,43.697018,-79.560039
5832,Castlemore Ave at The Bridle Walk,43.896173,-79.308064
5833,Caledonia Rd at Keith Ave,43.690575,-79.461131
5834,Elmhurst Dr at Albion Rd,43.724914,-79.550866
5840,Markham Rd at Ellesmere Rd,43.776283,-79.231507
5844,Bathurst St at Melrose Ave,43.727244,-79.431501
5845,Horner Ave at Tupper Ave West Side,43.606975,-79.522193
5846,Lawson Rd at Meadowvale Rd,43.785189,-79.160874
5848,Ellesmere Rd at Kennedy Rd,43.766017,-79.28076
5849,Kingston Rd at Beechgrove Dr,43.776756,-79.173534
5850,Markham Rd at Cougar Crt,43.744964,-79.219554
5851,Dundas St West at Paulart Dr East Side,43.631061,-79.54646
5852,Kennedy Rd at Flora Dr,43.748144,-79.274372
5853,Westhumber Blvd at Kipling Ave,43.727987,-79.574783
5861,York Mills Rd at Old York Mills Rd,43.744177,-79.404398
5863,Sheppard Ave East at Markham Rd,43.793616,-79.239385
5869,Opposite 327 Dixon Rd,43.695236,-79.555207
5871,Bathurst St at Finch Ave West,43.773623,-79.44272
5872,Yonge St at York Mills Rd North Side - York Mills Station,43.744863,-79.40666
5878,Sheppard Ave West at Chesswood Dr,43.755399,-79.474597
5880,Yonge St at Richmond St East,43.651579,-79.378823
5886,St Regis Cres at Keele St East Side,43.754624,-79.487752
5887,Kipling Ave at The Westway,43.685458,-79.554422
5889,Finch Ave East at Sandhurst Cir (East),43.808701,-79.263003
5890,Weston Rd at Kenhar Dr South Side,43.761317,-79.544728
5891,550 Oakdale Rd,43.750135,-79.526856
5892,Horner Ave at Belvia Rd,43.605324,-79.528711
5898,Yonge Blvd at Felbrigg Ave,43.736621,-79.409779
5901,Islington Ave at Vanhill Ave,43.757355,-79.570029
5902,Sheppard Ave East at Victoria Park Ave,43.775039,-79.323295
5905,MacDonell Ave at Queen St West North Side,43.640726,-79.437986
5907,Davisville Ave at Mt Pleasant Rd,43.700197,-79.387156
5918,Sheppard Ave East at Aragon Ave,43.779428,-79.304454
5925,Sheppard Ave East at Vandorf St,43.802813,-79.154995
5926,Oakwood Ave at Vaughan Rd,43.692326,-79.440768
5927,Victoria Park Ave at O'Connor Dr South Side,43.722825,-79.30202
5931,Morningside Ave at Walkway to McKnight Dr,43.810567,-79.203682
5938,Parliament St at Wellesley St East North Side,43.668507,-79.369582
5940,Dixon Rd at Islington Ave,43.697362,-79.54593
5943,Dundas St West at Indian Grove,43.665429,-79.462163
5944,Islington Ave at Albion Rd,43.736655,-79.56489
5947,Main St Markham North at Robinson St,43.877739,-79.260689
5950,Markham Rd at Eglinton Ave East,43.74298,-79.21863
5951,Toronto South Detention Centre,43.609554,-79.514632
5952,Jane St at Frith Rd,43.746533,-79.515127
5953,Moore Park Ave at Fargo Ave,43.792727,-79.424353
5958,Yonge St at Ellerslie Ave,43.772295,-79.413801
5962,Morningside Ave at McLevin Ave,43.809027,-79.203015
5963,Weston Rd at Garyray Dr,43.767534,-79.545753
5965,Rexdale Blvd at Precision Rd,43.715839,-79.59029
5970,Queen St West at Shaw St,43.64456,-79.416511
5973,Lawrence Ave West at Weston Rd  West Side,43.700019,-79.517036
5974,Steeles Ave East at Woodbine Ave,43.814178,-79.348291
5979,Neilson Rd at Silverbell Grove,43.804102,-79.217089
5980,Lawrence Ave East at Cedarbrae Mall,43.758704,-79.229975
5981,Oakwood Ave at Eglinton Ave West,43.696886,-79.442511
5984,Ossington Ave at Dundas St West North Side,43.649724,-79.420791
5987,Ellesmere Rd at Oakley Blvd East Side,43.768395,-79.268369
5990,Rexdale Blvd at Brydon Dr,43.711667,-79.57103
5991,6900 Airport Rd - International Centre - North Entrance,43.701831,-79.640204
5995,Bathurst St at Tichester Rd South Side,43.685088,-79.41918
5996,Sheffield St at Densley Ave South Side,43.704666,-79.470535
5997,22 Steinway Blvd,43.751547,-79.621338
5998,Bayview Ave at York Mills Rd,43.748322,-79.384408
6003,Finch Ave West at Keele St,43.763298,-79.49133
6007,John Garland Blvd at Jamestown Cres (West),43.732437,-79.58675
6008,Meadowvale Rd at Lavery Trail,43.795871,-79.164864
6010,Scarlett Rd at East Dr,43.676906,-79.506183
6012,Dixon Rd at Dixington Cres East Side,43.697806,-79.542843
6017,Grandravine Dr at Sentinel Rd,43.751779,-79.495535
6018,Lansdowne Ave at Brandon Ave North Side,43.669248,-79.447348
6019,Kipling Ave at Rexdale Blvd,43.711527,-79.566413
6023,Ossington Ave at Dupont St,43.670395,-79.429239
6024,Kipling Ave at Dixon Rd,43.694479,-79.558887
6032,Wilson Ave at Clyde Ave,43.738595,-79.426958
6033,Humber College Blvd at Highway 27,43.730243,-79.601847
6035,Eglinton Ave East at Falcon St West Side,43.709167,-79.386703
6036,Weston Rd at Fern Ave,43.70235,-79.523516
6043,Staines Rd at Seasons Dr South Side,43.830149,-79.223612
6044,Warden Ave at Manhattan Dr,43.752109,-79.297613
6047,Yonge St at Fairlawn Ave,43.730953,-79.403849
6049,Bergamot Ave at Rexdale Blvd North Side,43.713873,-79.559697
6052,Sheppard Ave East at Havenview Rd,43.791493,-79.249464
6053,Horner Ave at Thirtieth St,43.604156,-79.533871
6056,Ellesmere Rd at Borough Approach East,43.771125,-79.255707
6061,Weston Rd at Jane St,43.691391,-79.501346
6062,Dufferin St at Castlefield Ave,43.700952,-79.451951
6063,Signal Hill Ave at Steeles Ave West,43.752762,-79.624929
6064,Brimley Rd at Danforth Rd,43.735285,-79.247571
6066,Steeles Ave West at Adesso Dr,43.77444,-79.526647
6068,York Mills Rd at Cedarwood Ave West Side,43.745953,-79.394494
6071,Norfinch Dr at Finch Ave West North Side,43.756568,-79.524486
6072,Islington Ave at Bergamot Ave,43.716748,-79.555736
6080,Bayview Ave at Burleigh Heights Dr North Side,43.77972,-79.390855
6082,Keele St at Dundas St West,43.665275,-79.464376
6085,Birchmount Rd at Kingston Rd,43.693136,-79.26245
6088,Tuscan Gate at Sheppard Ave West,43.752921,-79.483158
6089,Opposite 950 Dixon Rd,43.686507,-79.598336
6090,Weston Rd at Sunset Trail,43.72174,-79.537093
6095,McCowan Rd at Highway 401,43.782557,-79.255208
6096,Victoria Park Ave at Farm Greenway,43.764563,-79.318432
6097,McCowan Rd at Nugget Ave,43.792208,-79.260059
6098,Finch Ave East at Longmore St,43.782077,-79.404565
6103,Sheppard Ave West at Weston Rd,43.733919,-79.537904
6107,Steeles Ave East at Strawberry Hills Dr,43.829662,-79.280495
6108,The Westway at Kipling Ave East Side,43.68565,-79.554169
6109,Yonge St at Sherwood Ave,43.713409,-79.39965
6111,Albion Rd at Bankfield Dr South Side,43.73072,-79.554499
6114,2900 Warden Ave - Bridlewood Mall,43.799239,-79.31716
6118,Carrier Dr at Albion Rd,43.745809,-79.614347
6123,Finch Ave East at Markham Rd,43.813199,-79.242764
6124,Victoria Park Ave at Tempo Ave,43.806522,-79.337577
6126,Brimley Rd at St Clair Ave East,43.721067,-79.241646
6127,Broadview Ave at Mortimer Ave North Side,43.684347,-79.356745
6131,Victoria Park Ave at Terraview Blvd,43.764448,-79.317956
6133,Bayview Ave at Post Rd North Side,43.736777,-79.381847
6138,Bathurst St at Laurelcrest Ave,43.74451,-79.435903
6141,Staines Rd at Warbler Cir,43.82671,-79.221682
6143,Islington Ave at The Kingsway North Side,43.668756,-79.533874
6145,Bayview Ave at York Mills Rd,43.747851,-79.383934
6157,McCowan Rd at Finch Ave East,43.80821,-79.266727
6159,Dundas St West at Chestnut Hills Cres,43.653186,-79.524855
6160,Sheppard Ave West at Dufferin St - Sheppard West Station,43.750543,-79.462607
6166,Bathurst St at Wilson Ave,43.737575,-79.434232
6177,Kipling Ave at Finch Ave West,43.743452,-79.582397
6181,Kipling Ave at Belfield Rd - Etobicoke North GO Station,43.705019,-79.563774
6183,Wellesley St East at Church St,43.66561,-79.381083
6189,Finch Ave East at Bridletowne Circle (East),43.797371,-79.312495
6196,Don Mills Rd at Cliffwood Rd (South),43.804969,-79.354936
6201,Islington Ave at Duncanwoods Dr North Side,43.754994,-79.568713
6206,Warden Ave at Cloverleaf Gate,43.773195,-79.305546
6207,Keele St at Arrowsmith Ave,43.704338,-79.477212
6211,Bayview Ave at McKee Ave,43.778139,-79.390729
6212,The Westway at Islington Ave,43.688783,-79.542618
6216,Royal York Rd at Kingsgrove Blvd,43.653862,-79.514294
6222,Kennedy Rd at Flora Dr,43.748488,-79.274791
6225,Dufferin St at King St West,43.638781,-79.427202
6226,Runnymede Rd at St John's Rd,43.663878,-79.481514
6232,2050 McCowan Rd,43.795063,-79.261173
6236,Royal York Rd at Cobble Hills,43.672692,-79.522574
6238,Lawrence Ave East at Megan Ave,43.771806,-79.170693
6239,Dundas St West at Runnymede Rd,43.665646,-79.481997
6240,Victoria Park Ave at Danforth Ave,43.691077,-79.288182
6241,Weston Rd at Wilby Cres - Weston GO Station,43.698344,-79.511454
6244,Islington Ave at Evans Ave,43.618201,-79.510979
6247,Albion Rd at Benstrow Ave,43.739092,-79.575981
6248,949 Wilson Ave,43.728771,-79.474465
6249,Sheppard Ave East at Morningside Ave West Side,43.801949,-79.200488
6251,Victoria Park Ave at Deanvar Ave,43.744898,-79.310652
6255,Islington Ave at Van Dusen Blvd,43.641604,-79.522221
6256,McCowan Rd at McNicoll Ave,43.817821,-79.271764
6258,Steeles Ave West at Gihon Spring Dr,43.759409,-79.596885
6259,Yonge St at Ranleigh Ave,43.728001,-79.403083
6261,Ellesmere Rd at McCowan Rd,43.771961,-79.251774
6263,Keele St at St Regis Cres,43.754658,-79.488881
6264,Wilson Ave at Lexfield Ave West Side,43.723418,-79.497052
6273,154 Norfinch Dr,43.764664,-79.530085
6276,Driftwood Ave at Laskay Cres,43.763306,-79.515272
6281,Bathurst St at Fairlawn Ave,43.724694,-79.430905
6283,Dufferin St at Hope St,43.682439,-79.444935
6288,Ossington Ave at Pendrith St,43.665987,-79.427402
6292,1901 Eglinton Ave East,43.726723,-79.291936
6294,Kipling Ave at St Andrews Blvd South Side,43.69826,-79.560584
6298,Steeles Ave West at Islington Ave East Side,43.76433,-79.57411
6299,Sheffield St at Hafis Rd North Side,43.706256,-79.470873
6301,Victoria Park Ave at Parma Crt South Side,43.716414,-79.299315
6302,Weston Rd at York Ave North Side,43.685981,-79.487374
6303,Neilson Rd at Milner Ave,43.795851,-79.216863
6306,Kingston Rd at Warden Ave,43.688019,-79.27067
6307,Moore Park Ave at Yonge St West Side,43.793725,-79.419859
6309,Jane St at Weston Rd,43.690987,-79.500683
6310,Brimley Rd at Minerva Ave,43.722726,-79.242349
6311,Brown's Line at Lake Shore Blvd West North Side,43.593366,-79.539333
6313,Steeles Ave West at New Westminster Dr,43.789674,-79.457799
6315,Beechgrove Dr at Janellan Ter,43.770246,-79.159896
6319,3800 Yonge St,43.739128,-79.405865
6321,Finch Ave East at Chartland Blvd South,43.80453,-79.282257
6326,Ormont Dr at Weston Rd,43.764703,-79.545746
6327,St Clair Ave East at Linden Ave - Scarborough GO Station,43.717955,-79.255615
6328,Port Union Rd at Conference Blvd,43.786201,-79.139536
6332,Pritchard Ave at Batavia Ave,43.670208,-79.489483
6333,Oakdale Rd at Eddystone Ave,43.746592,-79.526286
6337,4640 Finch Ave East,43.806496,-79.273956
6338,Bayview Ave at Fife Rd,43.754733,-79.385373
6340,Carrier Dr at Albion Rd,43.745234,-79.614192
6341,Victoria Park Ave at Huntingwood Dr,43.780242,-79.325218
6344,Wynford Dr at Garamond Crt West Side,43.725144,-79.333957
6346,Royal York Rd at Ashley Park Rd (North) North Side,43.663913,-79.518628
6348,Jane St at Sheppard Ave West,43.739514,-79.513403
6350,Lansdowne Ave at Wallace Ave,43.662412,-79.444618
6353,Finch Ave East at Maxome Ave East Side,43.783345,-79.398811
6355,Finch Ave East at Skymark Dr,43.793347,-79.352074
6357,Kennedy Rd at Steeles Ave East,43.823521,-79.3068
6358,Culford Rd at Lawrence Ave West North Side,43.706888,-79.487765
6359,Warden Ave at Bertrand Ave,43.733255,-79.289926
6360,Church St at George St,43.703987,-79.523486
6364,Kipling Ave at John Garland Blvd,43.735663,-79.578565
6366,Warden Ave at Opposite Walkway to Seagrave Cres,43.809163,-79.322396
6367,Dixon Rd at Attwell Dr,43.688146,-79.586563
6370,Bayview Ave at Lawrence Ave East - York University Glendon C,43.727686,-79.382237
6372,Morningside Ave at Tefft Rd,43.772365,-79.187508
6373,Greenwin Village Rd at Elise Ter (West),43.791763,-79.442132
6374,Eglinton Ave West at Kipling Ave,43.677014,-79.551181
6375,St Clair Ave East at Gidley Rd,43.719424,-79.247666
6377,Kipling Ave at Holywell Dr,43.68837,-79.556092
6378,Kingston Rd at Fallingbrook Rd,43.682141,-79.27935
6381,Finch Ave East at Sandhurst Cir (West),43.807357,-79.270215
6384,Bayview Ave at Kilgour Rd North Side - CNIB,43.71722,-79.378025
6385,Airport Rd at Highway 427 Overpass West Side,43.686436,-79.602317
6386,Victoria Park Ave at Gerrard St East,43.687541,-79.286934
6387,Victoria Park Ave at McNicoll Ave,43.804226,-79.336567
6392,Sheppard Ave East at Warden Ave,43.778548,-79.30811
6394,1180 Albion Rd,43.737809,-79.568184
6397,Scarlett Rd at Richview Rd North Side,43.685771,-79.51242
6405,Sheppard Ave East at Rainbow Ridge Ave,43.807276,-79.163127
6411,North Queen St at Eastside Dr,43.619964,-79.552113
6412,Dixon Rd at Havenridge Dr West Side,43.697927,-79.543338
6414,McCowan Rd at West Bay Drive,43.88726,-79.289261
6416,McCowan Rd at Huntingwood Dr,43.798816,-79.262774
6419,The East Mall at The Queensway,43.616743,-79.546582
6422,Dundas St West at Howland St,43.663985,-79.503463
6424,Kingston Rd at Poplar Rd,43.765656,-79.191176
6429,Grandravine Dr at Keele St West Side,43.751972,-79.488762
6431,Deauville Lane at Grenoble Dr South Side,43.716123,-79.33018
6433,Markham Rd at Tuxedo Crt,43.779611,-79.233182
6434,Lawrence Ave East at Brockley Dr,43.752209,-79.262362
6437,Royal York Rd at Strath Humber Crt,43.661189,-79.517388
6443,Steeles Ave East at Hillcroft Dr,43.829982,-79.280198
6446,Victoria Park Ave at Pleasant View Dr,43.785815,-79.328126
6452,Finch Ave East at Willowdale Ave,43.781737,-79.406965
6453,Steeles Ave East at Leslie St,43.808687,-79.372445
6454,Lawrence Ave East at Pharmacy Ave,43.743114,-79.304898
6456,Lawson Rd at Centennial Rd,43.787318,-79.151189
6460,Bayview Ave at Newton Dr,43.799231,-79.395302
6462,Lake Shore Blvd West at Thirty Ninth St West Side,43.59282,-79.541218
6463,Dufferin St at Billy Bishop Way North Side,43.730328,-79.458326
6464,Caledonia Rd at Summit Ave South Side,43.686437,-79.459522
6467,Lawson Rd at Cedarview Dr East Side,43.786882,-79.153183
6473,Islington Ave at Leduc Dr South Side,43.718169,-79.556712
6475,Signet Dr at Finch Ave West South Side,43.752754,-79.536043
6476,Don Mills Rd at Farmcote Rd North Side,43.74814,-79.346186
6477,Kingston Rd at Whitecap Blvd East Side,43.734323,-79.221794
6479,Ellesmere Rd at Dolly Varden Blvd,43.775626,-79.235048
6481,Sheppard Ave East at Scunthorpe Rd,43.793116,-79.241878
6484,Wellesley St East at Jarvis St,43.666368,-79.378188
6485,Yonge St at Castlefield Ave,43.711692,-79.399293
6486,Scarlett Rd at Scarlettwood Crt North Side,43.692838,-79.517514
6487,Victoria Park Ave at Ruscica Dr,43.734757,-79.306935
6488,Rexdale Blvd at Frost St,43.71244,-79.564054
6495,Steeles Ave East at Willowdale Ave,43.799392,-79.414344
6498,Opposite 4355-4363 Jane St,43.763886,-79.519352
6499,Wynford Dr at Wynford Heights Cres South Side,43.726234,-79.327495
6501,Weston Rd at Rogers Rd,43.681291,-79.476257
6506,Lawrence Ave West at Pimlico Rd West Side,43.707563,-79.482732
6507,Neilson Rd at Oakmeadow Blvd (North),43.791189,-79.213692
6508,Lawrence Ave East at Barrymore Rd,43.754129,-79.251669
6509,The Westway at Brougham Cres,43.686483,-79.552452
6510,Kingston Rd at Midland Ave West Side,43.710974,-79.248508
6511,East Ave at Tudor Glen Cres,43.789975,-79.135627
6514,Scarlett Rd at Eileen Ave,43.667889,-79.500203
6519,Norfinch Dr at Finch Ave West,43.756148,-79.52451
6524,Brown's Line at Jellicoe Ave,43.5964,-79.542659
6526,Weston Rd at Coral Gable Dr,43.735517,-79.538468
6529,Finch Ave East at Cherokee Blvd,43.793524,-79.337194
6530,Markham Rd at Edward Jeffreys Ave,43.896348,-79.265198
6531,Don Mills Rd at Clock Tower Rd,43.734675,-79.342942
6532,Kipling Ave at Wingrove Hill,43.654293,-79.540646
