stop_id,stop_name,stop_lat,stop_lon
8689,Bathurst St at York Downs Dr,43.747362,-79.436588
8691,Ellesmere Rd at Neilson Rd - Scarborough Health Network Cent,43.782805,-79.204762
8693,Warden Ave at McPherson St,43.833382,-79.328235
8694,Neilson Rd at Wickson Trail,43.801846,-79.217691
8695,7710 Markham Rd,43.853678,-79.255258
8696,Finch Ave East at Page Ave West Side,43.786782,-79.384733
8697,Kennedy Rd at Passmore Ave North Side,43.818875,-79.304769
8698,Church St at Cypress St,43.706615,-79.516833
8701,Shaw St at Queen St West,43.644422,-79.416079
8702,Kennedy Rd at McNicoll Ave South Side,43.811559,-79.301785
8703,Finch Ave East at Ravel Rd East Side,43.790302,-79.365145
8704,Sheppard Ave East at Brenyon Way West Side,43.800473,-79.207625
8705,Don Mills Rd at Mogul Dr,43.802406,-79.353199
8715,Lawrence Ave West at Westona St East Side,43.69728,-79.526961
8718,Runnymede Rd at Dundas St West North Side,43.666091,-79.482223
8719,Steeles Ave East at Walkway to Whitman St,43.800243,-79.409414
8721,Eglinton Ave East at Leslie St West Side,43.71711,-79.350179
8722,Signet Dr at Finch Ave West North Side,43.754061,-79.536541
8725,Victoria Park Ave at Ripon Rd,43.703874,-79.293941
8726,Bergamot Ave at Rexdale Blvd,43.71351,-79.55992
8727,Elmhurst Dr at Fordwich Cres,43.726312,-79.565479
8730,Islington Ave at Riverbank Dr,43.653404,-79.527358
8731,Warden Ave at 14Th Ave,43.837399,-79.328885
8733,Yonge Blvd at Harley Ave,43.738148,-79.41173
8737,Brimley Rd at Oakridge Dr,43.725802,-79.243379
8739,Broadview Ave at Pretoria Ave,43.678521,-79.358476
8740,Rexdale Blvd at Tidemore Ave,43.714705,-79.585408
8743,Foxwell St at Scarlett Rd,43.669481,-79.501455
8746,3311 Bayview Ave,43.790441,-79.39309
8747,Belfield Rd at Iron St,43.700484,-79.581284
8748,Eglinton Ave West at Spadina Rd,43.702476,-79.418837
8750,Islington Ave at Dundas St West,43.651252,-79.526155
8751,Islington Ave at Sandhill Dr,43.734462,-79.564233
8752,Horner Ave at Delta St West Side,43.603778,-79.536421
8756,Eglinton Ave West at Glenholme Ave,43.696854,-79.44508
8758,Lawrence Ave East at Kingston Rd,43.767433,-79.190127
8759,Warden Ave at Boem Ave,43.748435,-79.296105
8760,Brookmere Rd at Elmhurst Dr,43.728733,-79.572478
8761,Opposite 8270 Sheppard Ave East,43.803542,-79.192347
8765,Lawrence Ave West at Dufflaw Rd,43.712617,-79.460944
8767,Kennedy Rd at Munham Gate,43.759482,-79.278888
8771,Bayview Ave at Post Rd,43.736547,-79.382082
8772,Ellesmere Rd at Wye Valley Rd,43.764958,-79.284138
8784,Weston Rd at Knob Hill Dr,43.710855,-79.534765
8789,Lawrence Ave East at Scarborough Golf Club Rd,43.762057,-79.215531
8790,St Clair Ave East at Midland Ave,43.718543,-79.251592
8792,Ormont Dr at Barmac Dr (East),43.764704,-79.547461
8795,Thirtieth St at Lake Shore Blvd West,43.595474,-79.529908
8797,Brown's Line at Valermo Dr,43.605912,-79.546909
8799,Kingston Rd at Beechgrove Dr,43.776158,-79.173723
8803,Humberwood Blvd at Topbank Dr,43.730432,-79.619758
8805,Arrow Rd at Bartor Rd North Side,43.737823,-79.529694
8807,Opposite 1111 Arrow Rd,43.751047,-79.534451
8809,Warden Ave at Sherry Rd,43.723511,-79.286034
8810,Harefield Dr at Elmhurst Dr,43.727709,-79.569248
8811,Lawrence Ave West at Keele St East Side,43.708821,-79.477376
8818,Lawrence Ave East at Greencrest Circt East Side,43.760144,-79.223083
8821,Dundas St West at Wilmar Rd,43.63448,-79.541382
8822,Weston Rd at Gunns Rd South Side,43.675541,-79.470205
8823,Finch Ave East at Wayside Ave,43.80065,-79.299471
8826,Thirtieth St at Lake Shore Blvd West North Side,43.595671,-79.529797
8827,Kipling Ave at Longfield Rd,43.673677,-79.549483
8828,Finch Ave West at Champagne Dr,43.767646,-79.471686
8829,Bergamot Ave at Islington Ave,43.716772,-79.556363
8830,Markham Rd at Blakemanor Blvd South Side,43.750815,-79.222323
8833,Wilson Ave at Agate Rd West Side,43.725812,-79.486393
8835,Opposite 4000 Victoria Park Ave,43.813517,-79.340233
8838,Markham Rd at Opposite Walkway to Clandfield St,43.859187,-79.256598
8840,Bayview Ave at Holmes Ave,43.783024,-79.391817
8841,Maple Leaf Dr at Stella St,43.710176,-79.500282
8842,Airport Rd at Flight Training Centre,43.692952,-79.628239
8844,Yonge St at Steeles Ave West South Side,43.79729,-79.42005
8845,Steeles Ave East at Old English Lane,43.804155,-79.392546
8847,Warden Ave at Upton Rd,43.718146,-79.283427
8850,Military Trail at Old Kingston Rd,43.782049,-79.174233
8852,Markham Rd at Finch Ave East,43.813201,-79.243361
8857,Lawrence Ave East at Kingston Rd,43.767941,-79.188877
8860,Dufferin St at Bowie Ave,43.698016,-79.451269
8861,Eglinton Ave West at Opposite Walkway to Rangoon Rd,43.670682,-79.577791
8862,Yonge St at Davenport Rd,43.672987,-79.387984
8863,4121 Lawrence Ave East,43.766708,-79.193248
8864,225 Carrier Dr,43.74897,-79.615884
8869,Bathurst St at Wells St,43.670003,-79.413019
8871,Steeles Ave West at Highway 27,43.755222,-79.61449
8875,Dundas St West at East Mall Cres,43.630386,-79.549175
8876,Steeles Ave West at Gihon Spring Dr,43.7591,-79.597122
8878,Finch Ave East at Kenneth Ave,43.78032,-79.412517
8880,Humber College Blvd at John Garland Blvd West Side,43.733587,-79.594019
8882,Steeles Ave West at Yonge St West Side,43.798021,-79.42066
8886,Oakwood Ave at Clovelly Ave,43.694727,-79.441622
8892,Sheppard Ave East at Opposite Walkway to Winstanly Cres,43.799679,-79.210016
8895,Victoria Park Ave at Ivordale Cres (South),43.752759,-79.313327
8900,Bayview Ave at Empress Ave South Side,43.77398,-79.389824
8904,Steeles Ave East at Milliken Go Station,43.824927,-79.302122
8906,Finch Ave East at Middlefield Rd,43.810081,-79.257463
8907,Rexdale Blvd at Brydon Dr,43.711516,-79.571654
8913,Sheppard Ave East at Midland Ave,43.785496,-79.278393
8914,Keele St at Sheppard Ave West North Side,43.745187,-79.486295
8916,Eglinton Ave West at Caledonia Rd,43.693177,-79.46177
8920,Don Mills Rd at Cliffwood Rd (North),43.807061,-79.357042
8923,Warden Ave at Sherwood Ave South Side,43.741919,-79.293484
8926,Steeles Ave East at Shadlock St,43.834486,-79.260861
8927,Finch Ave East at Bayview Ave,43.784766,-79.392606
8932,Ellesmere Rd at Pharmacy Ave,43.75918,-79.310072
8935,McCowan Rd at Alton Towers Cir (South),43.822598,-79.274169
8936,Pape Ave at Floyd Ave,43.687418,-79.347965
8937,Bathurst St at Dupont St,43.67305,-79.41422
8938,Yonge St at Scollard St,43.672646,-79.387664
8942,Sheppard Ave East at Parkway Forest Dr East Side,43.775897,-79.342662
8943,620 Evans Ave,43.610447,-79.550449
8946,Harefield Dr at Hinton Rd,43.72686,-79.569503
8948,Broadview Ave at Cosburn Ave North Side,43.688765,-79.355048
8951,49 Thorncliffe Park Dr,43.702437,-79.342468
8952,Opposite 1859 Kingston Rd,43.695443,-79.259361
8955,Dufferin St at Eversfield Rd South Side,43.687023,-79.446808
8956,Markham Rd at Rochman Blvd South Side,43.76411,-79.227104
8958,Horner Ave at Alderbrae Ave,43.602596,-79.540853
8961,Neilson Rd at Sheppard Ave East,43.797971,-79.217375
8962,Royal York Rd at La Rose Ave,43.684028,-79.527197
8963,Sheppard Ave West at Banting Ave,43.751162,-79.459386
8966,Don Mills Rd at McNicoll Ave,43.799468,-79.353974
8969,Jane St at Wilson Ave North Side,43.721327,-79.50851
8970,Islington Ave at Milady Rd,43.752168,-79.568109
8973,Bayview Ave at Valley Rd,43.744116,-79.383516
8975,Victoria Park Ave at Ernest Ave,43.791872,-79.330958
8981,Steeles Ave West at Tandem Rd,43.782754,-79.489902
8983,Bathurst St at Glengrove Ave,43.714354,-79.428702
8988,Kingston Rd at Manderley Dr,43.689073,-79.269114
8991,Dundas St West at Humberside Ave,43.662951,-79.456295
8993,Finch Ave East at Bridletowne Circle (West),43.796055,-79.319098
8994,Bathurst St at Douglas Ave,43.720714,-79.429983
8995,Neilson Rd at Military Trail South Side,43.78765,-79.208069
8996,Concorde Pl at McDonald's Pl,43.727944,-79.328295
8997,Maple Leaf Dr at Liscombe Rd,43.7108,-79.498067
8999,Bayview Ave at Sheppard Ave East - Bayview Station,43.766792,-79.388244
9000,St Clair Ave East at Linden Ave - Scarborough GO Station,43.717393,-79.256113
9003,Dundas St West at Pacific Ave,43.66539,-79.468708
9004,Opposite 4981 Bathurst St,43.775844,-79.443659
9005,The Westway at Trehorne Dr,43.690998,-79.536223
9008,Airport Rd at American Dr,43.689113,-79.621705
9010,Eglinton Ave West at Bathurst St,43.700742,-79.426336
9012,Pelmo Cres at Longview Dr,43.710801,-79.510821
9019,Kennedy Rd at Collingwood St,43.781615,-79.287209
9022,Dufferin St at Hope St,43.68227,-79.444697
9023,Dufferin St at Whitley Ave,43.729347,-79.458372
9024,Jane St at Raven Rd North Side,43.713764,-79.506522
9028,Lake Shore Blvd West at Long Branch Ave,43.594693,-79.53303
9030,Bayview Ave at Kilgour Rd - CNIB,43.717092,-79.378325
9032,Harbord St at Bathurst St,43.661613,-79.409541
9033,Dundas St West at Windermere Ave,43.665676,-79.48568
9034,Broadview Ave at Cosburn Ave South Side,43.688182,-79.355485
9037,689 Warden Ave,43.707412,-79.278973
9041,Sheppard Ave West at Magellan Dr,43.739805,-79.509568
9043,Humberline Dr at Finch Ave West South Side,43.734366,-79.618132
9044,Yonge Blvd at Wilson Ave,43.741154,-79.41497
9047,Steeles Ave West at Klondike Dr,43.76923,-79.552088
9049,100 Wynford Dr (Bell Canada),43.726559,-79.33177
9051,Horner Ave at Thirtieth St,43.604404,-79.533571
9052,1111 Arrow Rd,43.751265,-79.534408
9054,Victoria Park Ave at Pachino Blvd North Side,43.76253,-79.317161
9055,5310 Finch Ave East,43.811532,-79.250495
9060,McCowan Rd at Pitfield Rd,43.787486,-79.257514
9062,Dufferin St at Melbourne Ave,43.640638,-79.428103
9063,Markham Rd at Greencedar Circt,43.757974,-79.224943
9071,Shorncliffe Rd at Dundas St West South Side,43.631702,-79.544524
9072,Lawrence Ave West at Duval Dr,43.709569,-79.474703
9073,Steeles Ave East at Conacher Dr,43.802369,-79.400756
9074,Wilson Ave at Apex Lane,43.728721,-79.475772
9077,St Clair Ave East at Santamonica Blvd,43.713222,-79.276424
9078,West Mall Cres at The West Mall West Side,43.627244,-79.559493
9081,Dufferin St at Auburn Ave,43.675421,-79.441934
9082,Steeles Ave West at Markbrook Lane,43.759939,-79.586358
9083,Parliament St at Howard St South Side,43.671114,-79.37085
9087,Sheppard Ave East at Gateforth Dr,43.79572,-79.230168
9088,Scarlett Rd at Chapman Rd North Side,43.689295,-79.514336
9089,Lansdowne Ave at Bloor St West,43.658445,-79.442808
9090,781 Warden Ave,43.724925,-79.286309
9096,12 Thorncliffe Park Dr,43.704579,-79.348905
9097,McCowan Rd at Devonshire Ave,43.838597,-79.277317
9100,Broadview Ave at Chester Hill Rd,43.681397,-79.357724
9102,Dixon Rd at Carlingview Dr,43.686894,-79.595256
9107,Neilson Rd at Military Trail,43.787917,-79.208112
9108,Keele St at George Appleton Way,43.724812,-79.481456
9109,Broadview Ave at Bater Ave,43.686963,-79.355778
9111,Runnymede Rd at Mac Gregor Ave,43.658484,-79.479458
9113,Bathurst St at Burton Rd,43.691765,-79.421687
9115,Hullmar Dr at Ruthmar Cres (South),43.762079,-79.526056
9118,Islington Ave at The Westway,43.688485,-79.542628
9122,Sheppard Ave East at Harrisfarm Gate,43.786963,-79.270764
9123,Victoria Park Ave at Eglinton Sq,43.722771,-79.30171
9124,Don Mills Rd at Eglinton Ave East South Side,43.720012,-79.338948
9126,Humber College Blvd at Westmore Dr - William Osler Health,43.731137,-79.598867
9129,Yonge St at Manor Rd East,43.702402,-79.397328
9134,Runnymede Rd at Annette St,43.659951,-79.47988
9135,740 Ellesmere Rd at Mondeo Dr,43.764086,-79.287886
9140,Sheppard Ave East at Harrisfarm Gate,43.787278,-79.270339
9144,Shaw St at Adelaide St West,43.642702,-79.415587
9147,Islington Ave at Fordwich Cres,43.726961,-79.560498
9148,Thorncliffe Park Dr East at Overlea Blvd South Side,43.707006,-79.343507
9149,Finch Ave East at Midland Ave,43.803931,-79.286077
9151,York Mills Rd at Don Mills Rd,43.755569,-79.347425
9152,Kingston Rd at Choiceland Blvd,43.787226,-79.164653
9156,Warden Ave at Alden Rd South Side,43.837188,-79.329261
9158,Steeles Ave East at Firebrace Rd West Side,43.817856,-79.332775
9159,Weston Rd at Seneca Ave,43.680249,-79.475239
9160,Attwell Dr at Disco Rd North Side,43.702454,-79.609324
9162,59 Lawson Rd,43.783965,-79.164127
9163,Queen's Plate Dr at Highway 27,43.722629,-79.598612
9164,Finch Ave East at Brahms Ave,43.792108,-79.357897
9172,Lawrence Ave West at Dufferin St,43.714223,-79.454377
9174,St Clair Ave East at Danforth Rd,43.717085,-79.259368
9176,York Mills Rd at Valentine Dr,43.757207,-79.341181
9177,Bathurst St at Mascot Pl,43.770483,-79.44229
9178,Don Mills Rd at Legato Crt,43.746211,-79.345677
9181,Lawson Rd at Port Union Rd,43.789502,-79.141184
9182,Warden Ave at Eglinton Ave East,43.728013,-79.287869
9183,Sheppard Ave East at Neilson Rd,43.798313,-79.217426
9188,Sheppard Ave East at Reidmount Ave - Agincourt GO Station,43.783793,-79.285171
9190,Wilson Ave at Avenue Rd,43.740088,-79.421033
9191,Bayview Ave at Sheppard Ave East North Side - Bayview Statio,43.767139,-79.387913
9193,Humberwood Blvd at Topbank Dr North Side,43.730593,-79.619596
9194,Yonge St at St Edmund's Dr,43.721852,-79.40142
9195,Morningside Ave at Ellesmere Rd,43.785474,-79.193594
9196,Scarlett Rd at Saxony Cres,43.690884,-79.516097
9198,Albion Rd at Armel Crt,43.72131,-79.545974
9200,Don Mills Rd at St Dennis Dr - Ontario Science Centre,43.716388,-79.33703
9201,Progress Ave at William Kitchen Rd,43.769923,-79.279404
9203,Islington Ave at Millwick Dr,43.759961,-79.571556
9205,Humber College Blvd at Lynmont Rd,43.732113,-79.595869
9207,Keele St at Toro Rd,43.759536,-79.489856
9213,Keele St at Beechborough Ave,43.694256,-79.474659
9215,Humberline Dr at Holyoake Cres (East),43.731737,-79.612174
9218,Meadowvale Rd at Euclid Ave,43.796107,-79.165195
9219,Progress Ave at Kennedy Rd East Side,43.769509,-79.281508
9220,Warden Ave at Comstock Rd,43.721839,-79.285342
9221,Kingston Rd at Pine Ridge Dr,43.730112,-79.226453
9225,John Garland Blvd at Martin Grove Rd East Side,43.73217,-79.588505
9228,Opposite 2002-2012 Sheppard Ave West,43.738511,-79.51671
9231,8800 Sheppard Ave East,43.804962,-79.187062
9232,Don Mills Rd at Duncan Mill Rd South Side,43.761374,-79.34741
9233,2265 Jane St,43.727526,-79.510107
9234,Gulliver Rd at Keele St,43.699193,-79.476217
9235,Kennedy Rd at Ellesmere Rd,43.765995,-79.281298
9236,Weston Rd at McCormack St,43.677134,-79.471618
9239,Albion Rd at Armel Crt,43.721252,-79.545458
9240,Islington Ave at Bywood Dr,43.659278,-79.529924
9241,Lansdowne Ave at Rideau Ave,43.646627,-79.438911
9242,Weston Rd at Cardell Ave,43.709803,-79.534726
9245,1300 Ellesmere Rd,43.769539,-79.26445
9249,Ossington Ave at Leeds St,43.663933,-79.426369
9251,Lawrence Ave East at Midland Ave West Side,43.751534,-79.265714
9253,Rossdean Dr at Steeles Ave West South Side,43.771026,-79.540507
9254,Victoria Park Ave at Steeles Ave East,43.815312,-79.341009
9255,Sheppard Ave East at Grand River Blvd South Side,43.805751,-79.160671
9258,Weston Rd at Ormont Dr,43.764726,-79.545136
9260,Wellesley St West at Queen's Park Cres East,43.663712,-79.390476
9267,Victoria Park Ave at Stamford Sq,43.710602,-79.296595
9271,Keele St at Humberside Ave,43.661716,-79.463068
9272,McCowan Rd at Castlemore Ave,43.898403,-79.291869
9278,Weston Rd at Dennis Ave,43.684931,-79.485196
9279,Sheppard Ave East at Parkway Forest Dr West Side,43.775632,-79.34516
9281,Kingston Rd at Pine Ridge Dr,43.730572,-79.226452
9282,The Westway at Fulford Pl,43.686504,-79.552001
9283,Bayview Ave at Garnier Crt,43.799066,-79.395034
9284,Eglinton Ave East at Credit Union Dr,43.725943,-79.318405
9286,Meadowvale Rd at Sheppard Ave East,43.808077,-79.170511
9287,Caledonia Rd at Kitchener Ave,43.689093,-79.460642
9288,Albion Rd at Islington Ave,43.73714,-79.56552
9289,Steeles Ave West at Dufferin St,43.787029,-79.470392
9291,St Clair Ave East at Brimley Rd,43.720746,-79.241603
9292,Warden Ave at Major Mackenzie Dr East,43.891683,-79.343031
9293,St Clair Ave East at North Woodrow Blvd,43.715452,-79.266449
9296,Lawrence Ave East at Port Union Rd West Side,43.779534,-79.137369
9299,Crow Trail at McGinty Pl,43.813581,-79.2284
9300,Airport Rd at American Dr North Side,43.689551,-79.621901
9301,Airport Rd at Northwest Dr,43.698911,-79.636345
9303,Lawrence Ave East at Markham Rd,43.759995,-79.225042
9312,Finch Ave East at Midland Ave,43.803604,-79.286527
9319,Finch Ave East at Gaspe Rd,43.785871,-79.388957
9320,Sheppard Ave East at Markham Rd West Side,43.793838,-79.239638
9323,Warden Ave at Boem Ave,43.748156,-79.295755
9324,Kennedy Rd at Bertrand Ave,43.737678,-79.270323
9327,Bayview Ave at Bayview Mews Lane,43.769272,-79.388448
9328,Eglinton Ave East at Wynford Dr,43.72404,-79.32621
9329,Bathurst St at Olive Ave,43.670382,-79.413366
9330,Finch Ave East at Brimley Rd,43.805534,-79.277614
9331,Islington Ave at Ambleside Ave,43.629214,-79.51696
9333,Weston Rd at Verobeach Blvd,43.738166,-79.539385
9335,Humber College Blvd at Highway 27 West Side,43.730352,-79.602333
9336,Yonge St at College St - College Station,43.661506,-79.38324
9337,Bayview Ave at Heathcote Ave,43.75232,-79.385153
9338,Ellesmere Rd at Claudius Gate,43.759437,-79.308022
9339,Sheppard Ave East at Meadowvale Rd East Side,43.808442,-79.169871
9340,Finch Ave East at Page Ave,43.786644,-79.384481
9343,Keele St at Falstaff Ave South Side,43.720257,-79.480793
9345,Island Rd at Port Union Rd,43.796153,-79.143039
9346,Dixon Rd at Riverview Heights West Side,43.701228,-79.52797
9349,St Clair Ave East at Birchmount Rd East Side,43.714182,-79.270532
9352,Wilson Ave at Dufferin St,43.731854,-79.459521
9354,Lawrence Ave East at Brimley Rd West Side,43.753545,-79.255814
9356,Islington Ave at Great Oak Dr,43.660902,-79.530629
9360,Kingston Rd at Glen Everest Rd,43.697867,-79.25667
9361,Sheppard Ave East at Birchmount Rd,43.781231,-79.297891
9364,Evans Ave at Sheldon Ave,43.611297,-79.545874
9365,Finch Ave East at Warden Ave,43.796616,-79.316027
9366,Islington Ave at New Toronto St South Side,43.606413,-79.506705
9371,Old Weston Rd at Rockwell Ave,43.676463,-79.463762
9372,Arrow Rd at Lido Rd South Side,43.74154,-79.530848
9375,Belfield Rd at Kipling Ave West Side - Etobicoke North GO St,43.704813,-79.564062
9376,Lawrence Ave West at Roxaline St,43.696903,-79.529527
9377,Grenoble Dr at Spanbridge Rd,43.713142,-79.326922
9379,Neilson Rd at McLevin Ave,43.809181,-79.222072
9382,Eglinton Ave East at Birchmount Rd,43.730169,-79.277553
9383,Warden Ave at 16Th Ave,43.874244,-79.338916
9386,Weston Rd at Steeles Ave West,43.770129,-79.546298
9387,St Clair Ave East at Kingston Rd,43.721743,-79.23683
9388,Main St Markham North at Princess St,43.866575,-79.258221
9390,Steeles Ave West at Kipling Ave,43.759394,-79.59007
9391,Bathurst St at Briar Hill Ave,43.707753,-79.426888
9392,Lawrence Ave East at Mossbank Dr West Side,43.763024,-79.210926
9394,Finch Ave West at Dufferin St,43.769131,-79.466342
9398,Opposite 350 Steeles Ave West,43.795105,-79.432906
9401,Elmhurst Dr at Drumheller Rd South Side,43.723664,-79.563472
9403,Sheppard Ave East at Twyn Rivers Dr North Side,43.809216,-79.166608
9406,Sheppard Ave West at Faywood Blvd,43.752518,-79.452096
9408,Signet Dr at Steeles Ave West,43.770606,-79.543123
9414,Ellesmere Rd at Military Trail (West),43.779894,-79.217004
9415,Wilson Ave at Wendell Ave,43.716951,-79.526937
9416,Yorkland Blvd (North) at Consumers Rd,43.773665,-79.332503
9417,Ossington Ave at Dewson St,43.65672,-79.423493
9419,Jane St at Troutbrooke Dr,43.732087,-79.511437
9422,Kingston Rd at Birchmount Rd East Side,43.693238,-79.261882
9423,Queen's Plate Dr at Highway 27,43.722879,-79.597436
9427,Driftwood Ave at Cobbler Cres (South),43.765619,-79.51163
9430,Dufferin St at Gordon St,43.646893,-79.43048
9437,Dundas St West at Prince Edward Dr North,43.660808,-79.510304
9440,Dufferin St at Briar Hill Ave,43.702508,-79.452277
9441,Islington Ave at Evans Ave South Side,43.617871,-79.511116
9442,Pape Ave at Danforth Ave,43.678778,-79.344739
9443,Fisherville Rd at Bathurst St West Side,43.79026,-79.446185
9444,Main St Markham North at Parkway Ave,43.881185,-79.261443
9446,East Ave at Island Rd,43.797824,-79.138695
9451,Sheppard Ave West at Chesswood Dr,43.755612,-79.473803
9452,Eglinton Ave West at Lloyd Manor Rd,43.675433,-79.558022
9453,Yonge St at Glenforest Rd North Side,43.730638,-79.40354
9456,Lawrence Ave East at Goldberry Sq,43.776098,-79.152547
9457,Meadowvale Rd at Sheppard Ave East North Side,43.808976,-79.170941
9459,Warden Ave at Bridletowne Cir (North),43.801367,-79.318512
9461,Arleta Ave at Medal Lane,43.747517,-79.506643
9462,Bathurst St at Sheppard Ave West,43.755214,-79.43823
9463,Victoria Park Ave at Steeles Ave East South Side,43.815023,-79.341245
9464,1450 Sheppard Ave West,43.744388,-79.488837
9465,1515 Albion Rd - Albion Library,43.740106,-79.583663
9466,Kennedy Rd at McNicoll Ave,43.811954,-79.301706
9467,Steeles Ave East at Fairway Heights Dr,43.807882,-79.375931
9469,York Mills Rd at Fenside Dr,43.760782,-79.327546
9470,York Mills Rd at Old York Mills Rd,43.744461,-79.404964
9471,20 Norelco Dr,43.762402,-79.533297
9472,North Queen St at The East Mall East Side,43.620509,-79.548785
9473,Sheppard Ave West at Tuscan Gate,43.75246,-79.482684
9475,1859 Kingston Rd,43.695079,-79.259393
9476,McCowan Rd at Commander Blvd,43.796262,-79.261695
9477,Bayview Ave at York Rd South Side,43.745809,-79.383845
9478,849 Broadview Ave,43.679214,-79.35811
9479,Keele St at Colville Rd,43.706337,-79.477644
9482,9275 Markham Rd,43.893736,-79.264383
9484,Sheppard Ave West at Goddard St,43.753643,-79.44794
9487,Lawrence Ave West at Ledbury St,43.720924,-79.422336
9488,38 Thorncliffe Park Dr,43.702133,-79.34446
9489,Gateway Blvd at Sunny Glenway (West) West Side,43.710687,-79.331693
9492,Mabelle Ave at Dundas St West,43.646426,-79.529926
9497,Dufferin St at Ascot Ave,43.680238,-79.444056
9498,Yonge St at Churchill Ave,43.773898,-79.414275
9499,Royal York Rd at Allanhurst Dr South Side,43.679033,-79.525302
9502,Albion Rd at Riverdale Dr,43.735283,-79.561541
9504,Lawrence Ave West at Bathurst St West Side,43.719198,-79.430504
9508,Humber College at Finch Ave West North Side,43.734475,-79.609669
9510,Bayview Ave at Dawlish Ave South Side,43.7243,-79.379746
9514,Lawrence Ave East at Galloway Rd,43.766302,-79.196286
9516,Dufferin Gate Loop,43.634401,-79.425872
9518,Opposite 60 Belfield Rd East Side,43.703369,-79.56919
9519,Thirtieth St at Akron Rd,43.600383,-79.532085
9520,Neilson Rd at Silverbell Grove South Side,43.804009,-79.217316
9522,McCowan Rd at Sandhurst Cir (South),43.805288,-79.265506
9525,Sheppard Ave West at Don River Blvd West Side,43.756599,-79.433307
9526,Sheppard Ave West at Tuscan Gate,43.752994,-79.482768
9530,Dufferin St at Liberty St,43.637414,-79.426893
9531,Bathurst St at Alcina Ave,43.680169,-79.417216
9532,Kipling Ave at Beaverbrook Ave,43.662466,-79.544522
9533,Steeles Ave West at Irondale Dr,43.769499,-79.549749
9534,Lawrence Ave West at Glen Rush Blvd,43.719781,-79.426884
9538,Markham Rd at Brimorton Dr,43.773714,-79.230844
9541,The Westway at Martin Grove Rd,43.683492,-79.566891
9543,Lawrence Ave West at Englemount Ave East Side,43.717282,-79.438059
9546,Garnett Janes Rd at Coin St,43.601428,-79.50908
9554,Rexdale Blvd at Kipling Ave,43.71146,-79.567189
9555,Kennedy Rd at Havendale Rd,43.791022,-79.291521
9557,Lawrence Ave West at Pimlico Rd,43.707392,-79.482544
9558,Arrow Rd at Sheppard Ave West North Side,43.736355,-79.529315
9561,Lawrence Ave East at Paulander Ave,43.775814,-79.15299
9562,Sheppard Ave East at McCowan Rd,43.789452,-79.25905
9563,Bathurst St at Ranee Ave,43.72707,-79.431662
9564,Warden Ave at Arkona Dr,43.772972,-79.30511
9565,Brimley Rd at Comrie Ter (North),43.726135,-79.243761
9567,Bloor St West at Islington Ave,43.64447,-79.523669
9568,2121 Kingston Rd,43.700849,-79.254485
9569,Wilson Ave at Belgrave Ave West Side,43.740676,-79.418495
9570,Sheppard Ave West at Laura Rd East Side,43.73784,-79.519602
9575,Finch Ave East at Alexmuir Blvd,43.804819,-79.282003
9578,Dixon Rd at Skyway Ave,43.687734,-79.587111
9579,Caledonia Rd at Norman Ave,43.677577,-79.45562
9581,McCowan Rd at Castlemore Ave,43.898895,-79.292372
9582,Walsh Ave at Weston Rd,43.717159,-79.537219
9584,Lawrence Ave East at Greenland Rd East Side,43.738331,-79.337526
9586,Weston Rd at Coronado Crt,43.740369,-79.539904
9587,Warden Ave at Bridletowne Cir (South),43.792101,-79.313683
9588,Sheppard Ave East at Meadowvale Rd,43.808525,-79.170563
9589,Passmore Ave at Kennedy Rd,43.818764,-79.303701
9590,Horner Ave at Sheldon Ave,43.602052,-79.543193
9595,East Ave at Kirkdene Dr,43.79529,-79.137805
9598,Yonge St at Sheppard Ave West - Sheppard Station,43.761686,-79.411123
9599,Dynamic Dr at Passmore Ave,43.829769,-79.253294
9600,Yonge St at Finch Ave East,43.779588,-79.415334
9603,Sheppard Ave East at Ecopark Gate East Side,43.805524,-79.183242
9604,Dundas St West at Glenlake Ave North Side,43.660077,-79.453638
9606,Kipling Ave at Albion Rd South Side,43.739088,-79.580217
9607,Kennedy Rd at Shropshire Dr North Side,43.757678,-79.277851
9609,Markham Rd at Stevenwood Rd North Side,43.755949,-79.223981
9611,Victoria Park Ave at Old Sheppard Ave,43.78047,-79.325602
9612,3008 Kennedy Rd,43.807615,-79.299985
9618,Warden Loop at Steeles Ave East,43.82097,-79.325087
9619,Driftwood Ave at Jane St East Side,43.765959,-79.519079
9620,Lawrence Ave East at Manse Rd West Side,43.770564,-79.176953
9621,Wilson Ave at Bathurst St East Side,43.737304,-79.433226
9628,Royal York Rd at Glendarling Rd,43.671004,-79.521641
9629,Kingston Rd at Brimley Rd West Side,43.718014,-79.240892
9632,Lawrence Ave West at Jane St,43.702738,-79.504198
9634,Humberwood Blvd at Kingsplate Cres West Side,43.723892,-79.616434
9638,Steeles Ave West at Murray Ross Pkwy East Side,43.776344,-79.516416
9639,Carlaw Ave at Eastern Ave North Side,43.658753,-79.339024
9641,Yonge St at Lord Seaton Rd,43.75233,-79.407869
9644,Steeles Ave West at Turbine Dr West Side,43.767973,-79.558138
9646,1 and 3 Concorde Pl North Side,43.728143,-79.328163
9647,Don Mills Rd at St Dennis Dr - Ontario Science Centre,43.716659,-79.337512
9648,180 Yorkland Blvd,43.771155,-79.335163
9649,Lawrence Ave East at Orton Park Rd,43.764262,-79.205256
